word	jp_defs	pos	hanja	jp_trans
랑	1.と 2.と 3.と。といっしょに【と一緒に】 4.と。や	「조사」		比較の対象、または基準となる対象であるという意を表す助詞。 誰かを相手にして何かを行うとき、その相手であるという意を表す助詞。 ある動作を一緒に行う対象であるという意を表す助詞。 前と後の名詞を同格でつなげる助詞。
량	りょう【両】	「의존 명사」		電車や汽車の車両を数える語。
-력	りょく・りき【力】	「접사」		「能力」または「力」の意を付加する接尾辞。 
-력	れき【暦】	「접사」		「暦」の意を付加する接尾辞。
-령	れい【令】	「접사」		「法令」または「命令」の意を付加する接尾辞。 
-령	りょう【領】	「접사」		「その国の領土」の意を付加する接尾辞。 
-령	ね・れい【嶺】	「접사」		「峠や山頂の名前」という意を付加する接尾辞。 
로	1.に。へ 2.に。を 3.に 4.で。から 5.で。に 6.で 7.で。によって。から 8.に。として 9.に 10.で。をもって 11.に 12.と。ことに 13.と。として。に	「조사」		動きの方向を表す助詞。 動きの経路を表す助詞。 変化の結果を表す助詞。 ある物の材料や原料を表す助詞。 ある動作を行うための手段や道具を表す助詞。 ある動作を行うための方法や方式を表す助詞。 ある出来事の原因や理由を表す助詞。 身分や資格を表す助詞。 時間を表す助詞。 時間を計算するとき、その限界となる基準を表す助詞。 特定の動詞と一緒に使われ、使役の対象、または一緒にその行為をする対象を表す助詞。  約束や決定を表す助詞。 ある事物についての考えや判断を表す助詞。
-로	1.ろ【路】 2.とおり・どおり【通り】	「접사」		「道」または「道路」の意を付加する接尾辞。 「大通りを中心に広がっている町」の意を付加する接尾辞。 
-로	ろ【炉】	「접사」		「材料を加熱して加工する所」の意を付加する接尾辞。
로까지	へまで。にまで	「조사」		最善、または最悪の状況のように極端な状況に至るという意を表す助詞。
로다가	1.に。へ 2.で。でもって 3.に 4.で。から 5.で。でもって 6.で 7.で。から。によって 8.に。として 9.から。より 10.で。をもって 11.と 12.と。に	「조사」		動きの方向を強調して表すのに用いる助詞。 動きの経路を強調して表すのに用いる助詞。 変化の結果を強調して表すのに用いる助詞。 ある物の材料や原料を強調して表すのに用いる助詞。 ある動作を行うための手段や道具を強調して表すのに用いる助詞。 ある動作を行うための方法や方式を強調して表すのに用いる助詞。 ある出来事の原因や理由を強調して表すのに用いる助詞。 地位や身分、または資格を強調して表すのに用いる助詞。 時間を強調して表すのに用いる助詞。 時間を計算するとき、その限界となる基準を強調して表すのに用いる助詞。 約束や決定を強調して表すのに用いる助詞。 ある事物についての考えや判断を強調して表すのに用いる助詞。
로맨틱하다	ロマンチックだ	「형용사」	romantic하다	感傷的で浪漫的な感じがある。
로부터	から。より	「조사」		ある行動や出来事の起点、あるいはその行動や出来事の源になる対象であるという意を表す助詞。
로서	として	「조사」		ある地位や身分、資格を表す助詞。
로써	1.で。から 2.で。でもって 3.で。をもって	「조사」		ある物の材料や原料を表す助詞。 ある動作を行うための道具や手段、方法を表す助詞。 前の言葉の表すところを限りにして、今まで述べた内容や今まで起こった出来事を含めるという意を表す助詞。
-론	1.ろん【論】 2.ろん【論】	「접사」	論	「それに関する学問」または「学問分野」の意を付加する接尾辞。 「主張」または「理論」の意を付加する接尾辞。 
-롭다		「접사」		「そうであること」または「それだけのことはある」という意を付加し、形容詞を作る接尾辞。
-료	1.りょう【料】 2.りょう【料】	「접사」	料	「料金」の意を付加する接尾辞。 「材料」の意を付加する接尾辞。 
-루	ろう【楼】	「접사」	樓	「高く建てた家」、「料理屋」の意を付加する接尾辞。 
-류	りゅう【流】	「접사」		「その特性や独特な傾向」の意を付加する接尾辞。 
-류	るい【類】	「접사」		「部類」の意を付加する接尾辞。 
-률	りつ【律】	「접사」		「法則」の意を付加する接尾辞。
-률	りつ【率】	「접사」		「比率」の意を付加する接尾辞。
를	1.を 2.に。を 3.を 4.を 5.に。を 6.に 7.を 8.を 9.を 10.	「조사」		動作が直接的に影響を及ぼす対象を表す助詞。 動作が間接的に影響を及ぼす対象や、それが目的であるという意を表す助詞。 材料や手段になる事物であるという意を表す助詞。 動作の到達点や動作の行われる場所を表す助詞。 ある目的をもって移動しようとする所を表す助詞。 ある行動の目的になる物事を表す助詞。 ある行動の起点を表す助詞。 ある動作・作用の源、あるいはその出来事を表す助詞。 対象の数量や動作の順序を表す助詞。 強調する意を表す助詞。
리	り【里】	「의존 명사」		距離の単位。
리	わけ。はず	「의존 명사」		理由や理知。
리	りん【厘】	「의존 명사」		歩合の単位。
-리-	1.させ 2.られ	「접사」		「使役」の意を付加する接尾辞。 「受身」の意を付加する接尾辞。
-리	り【裏】	「접사」		「真ん中」または「うち」の意を付加する接尾辞。 
리터	リットル	「의존 명사」	liter	主に気体や液体の量をはかる容量の単位。
-림	りん【林】	「접사」	林	「林」や「森」の意を付加する接尾辞。 
마	ヤード	「의존 명사」		布や紙の長さをはかる単位。
마구	1.むやみに【無暗に】。やたらに【矢鱈に】 2.むやみに【無暗に】。やたらに【矢鱈に】	「부사」		非常に酷く。 ぞんざいに。いい加減に。
마구마구	1.むやみに【無暗に】。やたらに【矢鱈に】 2.むやみに【無暗に】。やたらに【矢鱈に】	「부사」		続け様に非常に酷く。 続け様にぞんざいに。続け様にいい加減に。
마냥	1.ひたすら。ただ 2.おもうぞんぶん【思う存分】。おもいきり【思いきり】 3.ひじょうに【非常に】。きわめて【極めて】。たいへん【大変】	「부사」		いつまでもずっと。 不足がなくて心ゆくまで。 普通以上にとても。
마냥	ように。みたいに。ごとく【如く】	「조사」		模様や程度が似通っていたり同じであるという意を表す助詞。
마는	が。けれども。けれど。けど	「조사」		前の内容を認めながらも、それに対する疑問や、それから外れる状況などを述べるのに用いる助詞。
마다	たびに。ごとに。おきに。つど【都度】	「조사」		ことごとくという意を表すか、それぞれの状況が繰り返されるという意を表す助詞。 
마당	1.ばめん【場面】 2.マダン	「의존 명사」		ある事態が展開されている状況。 パンソリや仮面劇を数える語。
마따나	とおり【通り】。ように。ごとく【如く】	「조사」		「述べた通り」「述べたように｣という意を表す助詞。
마땅찮다	1.ふまんだ【不満だ】 2.ふてきだ【不適だ】。ふてきとうだ【不適当だ】	「형용사」		気に食わない。 適当ではない。
마땅하다	1.てきとうだ【適当だ】。てきせつだ【適切だ】。ふさわしい【相応しい】 2.きにいる【気に入る】 3.とうぜんだ【当然だ】。あたりまえだ【当たり前だ】	「형용사」		ある条件にうまく当てはまる。 好みに合う。 正しかったり、道理にかなっていたり、当たり前だったりする。
마땅히	1.とうぜん【当然】。あたりまえに【当たり前に】 2.とくに【特に】。べつに【別に】	「부사」		そうすることが正しくて、当たり前に。 ある条件や状況に合って。
마뜩하다	きにいる【気に入る】。まんぞくだ【満足だ】	「형용사」		ずいぶん気にいる。
마력	ばりき【馬力】	「의존 명사」		動力や仕事の量をはかる単位。
마련	もの	「의존 명사」		当然そうであるという意を表す語。
마렵다	べんいがある【便意がある】	「형용사」		大小便をしたい。
마리	ひき【匹】。とう【頭】。わ【羽】。お【尾】	「의존 명사」		獣・魚・虫などを数える単位。
마음껏	おもうぞんぶん【思う存分】。おもいきり【思いきり】	「부사」		満足するまでいくらでも。
마음대로	おもうとおりに【思う通りに】。きままに【気ままに】	「부사」		自分の希望通りに。
마일	マイル【哩】	「의존 명사」	mile	距離の単位。
마장	マジャン	「의존 명사」		距離の単位。
마저	も。まで。すら。さえ	「조사」		現在の状態や程度に、最後に残った一つを加えるという意を表す助詞。
마주	1.むきあって【向き合って】 2.おなじく【同じく】	「부사」		互いに正面を見て。 相手の行動にすぐ倣ってそれと同じく。
마지기	マジギ	「의존 명사」		田畑の面積をはかる単位。
마지못하다	やむをえない【やむを得ない】。しかたない【仕方ない】	「형용사」		したくはないが、するしかない。
마지아니하다	やまない	「보조 동사」		前の言葉の表す行動を心をこめて本気で行うという意を表す「補助動詞」。
마지않다	やまない	「보조 동사」		前の言葉の表す行動を心をこめて本気で行うという意を表す「補助動詞」。
마치	まるで。あたかも。ちょうど【丁度】。さながら	「부사」		他の物にたとえて表現すると。
마침	ちょうど【丁度】。たまたま。あいにく。ちょうどいいところへ	「부사」		ある機会や状況にぴったり合うように偶然。
마침내	1.とうとう。ついに。あげくのはて【挙句の果て】 2.とうとう。ついに。けっきょく【結局】	「부사」		とどのつまり結局。 とうとう最後には。
마흔	しじゅう・よんじゅう【四十】	「수사」		十の4倍になる数。
마흔	しじゅう・よんじゅう【四十】	「관형사」		10の4倍の数の。
막	1.たったいま【たった今】 2.ちょうど【丁度】。ちょうどそのとき【丁度その時】	「부사」		まさに今。 まさにその時。
막-	1.やす【安】。あら【粗】 2.あら【荒】 3.	「접사」		「粗い」または「質の悪い」という意を付加する接頭辞。 「手当たり次第」という意を付加する接頭辞。 「躊躇せずに」または「やたらに」という意を付加する接頭辞。
막	1.むちゃくちゃに。やたらに【矢鱈に】。むやみに【無闇に】 2.やたらに【矢鱈に】。むやみに【無闇に】。らんぼうに【乱暴に】	「부사」		とてもひどく。 向こう見ずで勝手に。
막-		「접사」		「最後」という意を付加する接頭辞。 
-막		「접사」		「そうなっている所」の意を付加し、名詞を作る接尾辞。 
막	まく【幕】	「의존 명사」		演劇で、幕が上がってからその幕が下ろされるまでの場面を数える単位。
막강하다	きょうりょくだ【強力だ】。きょうだいだ【強大だ】	「형용사」	莫強하다	対抗できないほど、ものすごく強い。
막다르다	つきあたる【突き当たる】。ゆきづまる【行き詰まる】	「형용사」		それより先へ進めないよう、前がふさがれている。
막대하다	ばくだいだ【莫大だ】	「형용사」	莫大하다	この上なく多いか大きい。
막되다	1.ぶさほうだ【無作法・不作法だ】。ふしつけだ。らんぼうだ【乱暴だ】 2.そぼうだ【粗暴だ】	「형용사」		言動がぶしつけで乱暴だ。 粗くて良くない。
막막하다	1.ばくばくだ【漠漠だ】。さびしい【寂しい】 2.さびしい【寂しい】 3.きゅうくつだ【窮屈だ】	「형용사」		周りが寂しくて静かである。 頼るところなどなくて、寂しくて窮屈である。 ぎっしりとふさがっているようで窮屈だ。
막막하다	1.ばくばくだ【漠漠だ】 2.ばくぜんだ【漠然だ】	「형용사」		果てしなく広くてぼうっとする。 果てしなく感じられ、漠然である。
막상	いざ。じっさいに【実際に】	「부사」		考えとは違って実際にあたってみると。
막심하다	ばくだいだ【莫大だ】。このうえない【この上ない】。しんだいだ【甚大だ】。はなはだしい【甚だしい】	「형용사」	莫甚하다	程度が甚だしい。
막역하다	ばくげきだ・ばくぎゃくだ【莫逆だ】	「형용사」	莫逆하다	互いに非常に親しい。
막연하다	1.ばくぜんたる【漠然たる】 2.ばくぜんたる【漠然たる】	「형용사」	漠然하다	あることに直面した時、どうしたらいいか分からない。 ぼんやりして、はっきりしない。
막연히	ばくぜんと【漠然と】	「부사」	漠然히	ぼんやりして、はっきりせずに。
막중하다	じゅうだいだ【重大だ】。きちょうだ【貴重だ】	「형용사」	莫重하다	この上なく重要で大きい。
막힘없다	さしつかえない【差し支えない】。さしさわりない【差し障りない】。じゅんちょうだ【順調だ】	「형용사」		仕事が捗って、妨げになるものがない。
막힘없이	さしつかえなく【差し支えなく】。さしさわりなく【差し障りなく】。じゅんちょうに【順調に】	「부사」		妨げられず、容易に。
만	1.め【目】。ぶり 	「의존 명사」		時間がある程度経過したという意を表す語。 
만		「의존 명사」		前の言葉の表す行動にはそれに値する理由があるという意を表す語。 前の言葉の表す行動が可能であるという意を表す語。
만	1.だけ。のみ 2.ばかり。だけ。のみ。さえ 3.だけ。のみ 4.ほど 5.だけ。のみ	「조사」		他の物事は除き、特定の物事に限定するという意を表す助詞。 何かを強調するという意を表す助詞。 話し手の期待する最小限の限度を表す助詞。 前の言葉が比較の対象であるという意を表す助詞。 前の言葉が何かについての条件であるという意を表す助詞。
만	が。けれども。けれど。けど	「조사」		前の内容を認めながらも、それに対する疑問や、それから外れる状況などを述べるのに用いる助詞。
만	まん【万】。いちまん【一万】	「수사」		一千の10倍になる数。
만	まん【万】。いちまん【一万】	「관형사」		一千の10倍になる数の。
만	まん【満】。まる【丸】	「관형사」		日・週・月・年・年齢など、一定の期間が満ちていることを表す語。
만만세	ばんばんざい【万万歳】	「감탄사」	萬萬歲	「万歳」を強調していう語。
만만찮다	あなどれない【侮れない】。てごわい【手ごわい】	「형용사」		取り扱いがままならないか、量が多い。
만만하다	くみしやすい【与し易い】	「형용사」		手強くなく、扱いやすい。
만만하다	まんまんたる【満満たる】	「형용사」		不足がなく、満ち満ちている。
만만히	くみしやすく【与し易く】。あまく【甘く】	「부사」		手強くなく、扱いやすく。
만만히	まんまんと【満満と】	「부사」		不足がなく、満ち満ちているさま。
만면하다	まんめんだ【満面だ】	「형용사」	滿面하다	感情や気持ちなどが顔じゅうに表れている。
만무하다	はずがない	「형용사」	萬無하다	その事態が起こる可能性が決してない。
만부득이	やむをえず【止むを得ず】。しかたなく【仕方なく】	「부사」	萬不得已	止むを得ないさまを強調していう語。
만부득이하다	やむをえない【止むを得ない】。しかたがない【仕方がない】	「형용사」	萬不得已하다	止むを得ないことを強調していう語。
만성적	1.まんせいてき【慢性的】 2.まんせいてき【慢性的】	「관형사」		ある性質や現状が長く続いたり、繰り返され、なかなか変わらないさま。 病状はひどくないが、ゆっくり進行し、なかなか治らないこと。
만족스럽다	まんぞくだ【満足だ】	「형용사」	滿足스럽다	期待したり必要としたりしたことが、満ち足りて嬉しい。
만족스레	まんぞくに【満足に】	「부사」	滿足스레	期待したり必要としたりしたことが、満ち足りて嬉しく。
만족하다	まんぞくだ【満足だ】	「형용사」		満ち足りて嬉しい。
만지작만지작	いじいじ。ごそごそ	「부사」		しきりに手でつかんだり放したりしながらいじり回す様子。
만치	1.ほど【程】。くらい・ぐらい【位】。だけ 2.だけ。だけに	「의존 명사」		前の内容と同じ量や程度であるという意を表す語。 前の内容が続く内容の原因や根拠になるという意を表す語。
만치	だけ。ほど	「조사」		前の言葉とその程度がほぼ同じ水準か、それと同じであるいう意を表す助詞。
만큼	1.ほど【程】。くらい・ぐらい【位】。だけ 2.だけ。だけに	「의존 명사」		前の内容と同じ量や程度であるという意を表す語。 前の内容が続く内容の原因や根拠になるという意を表す語。
만큼	だけ。ほど	「조사」		前述した内容とほぼ同じ程度や限度であるという意を表す助詞。
만판	ぞんぶんに【存分に】。じゅうぶんに【十分に】	「부사」		思い通りにいつまでもたくさん。
만하다	1.にあたいする【に値する】 2.ことができる。（ら）れる	「보조 형용사」		前の言葉の表す行動をするに値するという意を表す「補助形容詞」。 前の言葉の表す行動をすることができるという意を表す「補助形容詞」。
많다	おおい【多い】。たくさんだ【沢山だ】。かずおおい【数多い】。ゆたかだ【豊かだ】	「형용사」		数や量、程度などが一定の基準を超える。
많이	おおく【多く】。たくさん【沢山】。かずおおく【数多く】。ゆたかに【豊かに】	「부사」		数や量、程度などが一定の基準を超えて。
맏-	1.ちょう【長】 2.はつ【初】	「접사」		「長子」という意を付加する接頭辞。 「その年の初物」という意を付加する接頭辞。 
말	ます【枡】	「의존 명사」		穀物・液体・粉などの分量をはかる単位。
말	まつ・すえ【末】	「의존 명사」		ある期間の終わり。
말갛다	1.きよい【清い】。すんでいる【澄んでいる】 2.うすい【薄い】 3.はっきりする	「형용사」		清くて澄んでいる。 汁物などの液体が濃くなくて薄い。 表情や意識がはっきりしていて活気付いている。
말끄러미	じっと。まじまじ	「부사」		目を開けたまま動かずに一ケ所だけを凝視する様子。
말끔	すっかり。みんな	「부사」		少しも残さず全部。
말끔하다	きれいだ【綺麗だ・奇麗だ】。すっきりする	「형용사」		埃やきずがなく、明るくて清潔だ。
말끔히	きれいに【綺麗に・奇麗に】。すっきり	「부사」		埃やきずがなく、明るくて清潔に。
말다	1.ない 2.しまう 3.しまう	「보조 동사」		前の言葉の表す行動をしないようにするという意を表す「補助動詞」。 前の言葉の表す行動が結局完了したという意を表す「補助動詞」。 前の言葉の表す行動を自分の力でやり遂げようとする話し手の強い意志を表す「補助動詞」。
말똥말똥	1.まじまじ 2.まじまじ	「부사」		目付きや精神などが生気があって清いさま。 目を丸く開いてじっと見つめるさま。
말똥말똥하다	まじまじする	「형용사」		目付きや精神などが生気があって清い。
말똥하다		「형용사」		目つきや精神などに生気があって清らかだ。
말랑말랑	ぶよぶよ。ふかふか	「부사」		非常に滑らかで、しなやかで柔らかい感じ。
말랑말랑하다	1.やわらかい【柔らかい・軟らかい】。ふわふわする 2.もろい【脆い】。ふにゃふにゃする	「형용사」		とても柔らかくてふかふかしている。 人の性格が強くなくて柔らかい。
말랑하다	1.やわらかい【柔らかい・軟らかい】 2.もろい【脆い】。ふにゃふにゃする	「형용사」		柔らかくてふかふかしている。 人の性格が強くなくて柔らかい。
말쑥하다	1.きれいだ。さっぱりだ 2.せんれんされている【洗練されている】。あかぬけている【垢抜けている】	「형용사」		さっぱりしていてきれいである。 端正で洗練されている。
말없이	1.だまって【黙って】。むごんで【無言で】 2.もくもくと【黙黙と】	「부사」		何も言わずに。 文句などを言わず黙って。
말짱	かんぜんに【完全に】。まったく【全く】。すっかり	「부사」		もれなく全部。
말짱하다	1.せいじょうだ【正常だ】 2.はっきりする 3.きれいだ【綺麗だ・奇麗だ】。きちんとする。ちゃんとする	「형용사」		傷や怪我など、欠けたところがない。 精神が明瞭で確かだ。 汚れなどがなく、きれいで清潔だ。
말짱히	1.せいじょうに【正常に】 2.はっきり 3.きれいに【綺麗に・奇麗に】。きちんと。ちゃんと	「부사」		傷や怪我など、欠けたところのない状態に。 精神が明瞭で確かな状態に。 汚れなどがなく、きれいで清潔な状態に。
말초적	1.まっしょうてき【末梢的】 2.まっしょうてき【末梢的】。きょうみほんいの【興味本位の】	「관형사」		根本的または重要でない、取るに足りない小さいさま。 精神的な感動がなく、肉体的な快楽やおもしろみ、興味が中心になるさま。
맑다	1.きよい【清い】 2.はれる【晴れる】 3.さえる【冴える】。すむ【澄む】 4.さえる【冴える】。はっきりする 5.きよい【清い】	「형용사」		汚れているものが混ざっていず、きれいである。 雲や霧がなく、天気がいい。 音などがはっきりと鮮明である。 意識がぼんやりしていず、はっきりしている。 心が純粋で、きれいである。
맘껏	おもうそんぶん【思う存分】。おもいきり【思いきり】	「부사」		満足するまでいくらでも。
맘대로	おもうとおりに【思う通りに】。きままに【気ままに】	「부사」		自分の希望通りに。
맙소사	まったく。なんてこった。これは大変だ。 まさか。オーマイゴッド。わたしとしたことが【私としたことが】	「감탄사」		あきれたり大変なことになった時、嘆くようにいう語。
맛깔스럽다	1.うまい【美味い】。おいしい【美味しい】 2.うまい【上手い・巧い】	「형용사」		食べ物の味が良い。 気に入るほど良い。
맛깔스레	1.うまく【美味く】。おいしく【美味しく】 2.うまく【上手く・巧く】	「부사」		食べ物の味が良く。 気に入るほど良く。
맛나다	おいしい【美味しい】。うまい【旨い・美味い】	「형용사」		味が良い。
맛없다	まずい。おいしくない	「형용사」		飲食物の味が良くない。
맛없이	まずく	「부사」		食べ物の味が薄すぎたり、うまくないように。
맛있다	おいしい【美味しい】。うまい【旨い・美味い】	「형용사」		味が良い。
망극하다	かぎりなくかなしい【限りなく悲しい】	「형용사」		王や親、親しい人などの不幸に対する悲しみが大きい。
