word	jp_defs	pos	hanja	jp_trans
아무리	まさか	「감탄사」		決してそんなはずがない、信じられないという意を表す時にいう語。
아무아무	だれだれ【誰誰】。だれそれ【誰それ】	「대명사」		不特定の、漠然とした人たちを指していう語。
아무쪼록	なにとぞ【何卒】。くれぐれも【呉呉も】	「부사」		できるかぎり。
아무튼	とにかく。なにはともあれ【何はともあれ】	「부사」		何がどうなっていても。
아무튼지	とにかく。なにはともあれ【何はともあれ】	「부사」		何がどうなっていても。
아뭏든		「부사」		
아뿔싸	しまった	「감탄사」		失敗をしたり、見逃していたことに気づいて反省したりする時に思わず口から出でくる語。
아삭	さくっと	「부사」		柔らかくて新鮮な果物や野菜を噛む時の音。
아서라	やめな。やめなさい	「감탄사」		そうするなと命令する時にいう語。
아쉽다	1.ほしい。ものたりない【物足りない】 2.みれんがましい【未練がましい】。おしい【惜しい】。ざんねんだ【残念だ】	「형용사」		必要な物がなかったり不足したりして、満足できない。 未練が残り、残念である。
아슬아슬	1.ぞくぞく。ひやひや【冷や冷や】 2.はらはら。ひやひや【冷や冷や】。かすかす	「부사」		鳥肌が立つほど少し寒気がするさま。 物事がうまく行かないことを恐れて鳥肌が立つほど危ぶむさま。
아슬아슬하다	1.ぞくぞくする。ひやひやする【冷や冷やする】 2.はらはらする。ひやひやする【冷や冷やする】。かすかすする	「형용사」		鳥肌が立つほど少し寒気がするようである。 物事がうまく行かないことを恐れて鳥肌が立つほど危ぶむ。
아아	1.わぁ。ああ 2.おお。おっと 3.わあ	「감탄사」		大いに感動したり、とても落胆してため息をついたりする時に思わず口から出てくる声。 驚いたり意外な事態に出くわした時、思わず口から出てくる声。 群れを成して戦ったり団体で試合をする時、気合を入れたり励ましたりする目的で出す声。
아야	1.いてっ 2.おっと。やっちゃった	「감탄사」		突然痛みを感じた時に思わず口から出てくる声。 失敗をやらかしたことに気づいた時に出す声。
아예	1.はじめから【初めから】。あたまから【頭から】。てんから【天から】。てんで 2.まったく【全く】。あたまから【頭から】。てんから【天から】。てんで 3.すっかり。かんぜんに【完全に】	「부사」		事前に。また、最初から。 絶対に。また、少しも。 全的に。
아옹다옹	いがみあっている【いがみ合っている】	「부사」		些細なことでよく喧嘩するさま。
아울러	1.あわせて【合わせて・併せて】 2.あわせて【合わせて・併せて】。いっしょに【一緒に】。ともに【共に】	「부사」		それとともに。 同時に。
아유	1.ふう。ああ。あら 2.あら。ああ	「감탄사」		痛かったり辛かったり驚いたり呆れたりしたときに発する声。 誰かに会って嬉しいときや非常に気分がいいときに発する声。
아이	1.ねえ。ってば。いや 2.ふう。ああ。あら 3.あら。ああ	「감탄사」		何かを催促するときや何かが気に入らないときに発する声。 痛かったり辛かったり驚いたり呆れたりしたときに発する声。 誰かに会って嬉しいときや非常に気分がいいときに発する声。
아이고	1.あ。あら。やれやれ。まあ 2.あら。まあ 3.やれやれ 4.	「감탄사」		痛みを感じたり、苦労したり、驚いたり、呆れたりした時に発する語。 懐かしかったり嬉しかったりしてたまらない時に発する語。 絶望したり胸が痛んだりして、ため息をしながら発する語。 誰かが死んだ時や悔しい時に泣きながら発する語。
아이고머니	あらまあ	「감탄사」		ひどく痛かったり辛かったり驚いたり呆れたりしたときに発する声。
아이고머니나	あらまあ	「감탄사」		ひどく痛かったり辛かったり驚いたり呆れたりしたときに発する声。
아이구		「감탄사」		
아이구머니		「감탄사」		
아이참	まったくもう	「감탄사」		恥じらいや苛立ちを表す時や、気に入らない時にいう語。
아장아장	よちよち 	「부사」		子供や小さい動物があちこちに少し傾いてゆっくり歩くさま。
아주	1.ひじょうに【非常に】。とても。たいへん【大変】 2.すっかり。かんぜんに【完全に】	「부사」		普通の程度をはるかに超えた状態で。 ある行動や作用などがすでに行なわれてしまって、どうしよもない状態で。
아주	おやおや。ちぇーっ	「감탄사」		人の言動を軽く受け止めて笑う時や、人の言動が気に入らない時にいう語。
아직	まだ【未だ】 	「부사」		あることや状態になるまでにさらに時間がかかるべきことを表す語。また、あることや状態が終わらずに続くことを表す語。
아직껏	いまだに【未だに】	「부사」		「まだ」を強調していう語。
아쭈	おやおや。ちぇーっ	「감탄사」		人の言動を軽く受け止めて笑う時や、人の言動が気に入らない時にいう語。
아찔	くらりと	「부사」		驚いたりしていきなり気がぬけてめまいがする感じ。
아찔하다	くらりとする	「형용사」		驚いたりしていきなり気がぬけてめまいがする。
아차	しまった【仕舞った】	「부사」		誤ったり間違ったりして、計画通りに行かないさま。
아차	おっと。しまった。やっちゃった	「감탄사」		間違いに気づいた時に思わず口から出てくる語。
-아치		「접사」		「その仕事を職業にする人」の意を付加する接尾辞。
아프다	1.いたい【痛い】。びょうきになる【病気になる】。いたむ【痛む】 2.いたむ【痛む】。ぐあいがわるい【具合が悪い】。ちょうしがわるい【調子が悪い】 3.なやましい【悩ましい】 4.こころぐるしい【心苦しい】。つらい【辛い】	「형용사」		怪我をしたり病気になったりして、痛みや苦しみを覚える。 体のある部分を使いすぎて、疲れや苦しみを覚える。 解決し難い事や複雑な問題のために苦しい。 悲しみや哀れみのため、心が苦しい。
아하	ああ。そうか	「감탄사」		前もって考えられなかったことに気づいた時に思わず口から出てくる声。
아홉	く・きゅう・ここ・ここの【九】	「수사」		八に一を足した数。
아홉	きゅう・く【九】	「관형사」		8に1を足した数の。
아홉째	ここのつめ【九つ目】	「수사」		順番の9番目。
아홉째	ここのつめ【九つ目】	「관형사」		順番の9番目の。
아휴	もう。はぁー	「감탄사」		大変だったりあきれたり挫折した時に思わず口から出てくる声。
아흔	きゅうじゅう【九十】	「수사」		10の9倍となる数。
아흔	きゅうじゅう【九十】	「관형사」		10の9倍となる数の。
악	1.きゃー 2.きゃー	「감탄사」		人が驚くほど大声でいきなり叫ぶ声。 驚いた時に思わず口から出てくる声。
악독하다	あくどい。じゃあくだ【邪悪だ】	「형용사」	惡毒하다	たちがひどく悪くて毒々しい。
악랄하다	あくらつだ【悪辣だ】	「형용사」	惡辣하다	たちが悪くて残酷だ。
악마적	あくまてき【悪魔的】	「관형사」		悪魔のようなさま。 
악착같다	あくせくする【齷齪する・偓促する】	「형용사」	齷齪같다	非常に頑固で粘り強い。
악착같이	あくせくと【齷齪と・偓促と】	「부사」	齷齪같이	非常に頑固で粘り強く。
악착스럽다	あくせくする【齷齪する・偓促する】	「형용사」	齷齪스럽다	非常に頑固で粘り強く物事を処理していこうとする。
악하다	わるい【悪しい】 	「형용사」	惡하다	心や行動が善良でない。
-안	がん【岸】	「접사」	岸	「海と接する陸地」の意を付加する接尾辞。
안		「부사」		否定や反対の意を表す語。
안녕	げんき【元気】。げんきで【元気で】。さよなら。じゃあ。バイバイ	「감탄사」		友人や目下の人と会った時や別れる時にいうあいさつの言葉。
안녕하다	1.あんねいだ【安寧だ】 2.あんねいだ【安寧だ】	「형용사」	安寧하다	問題や心配事がなく安らかである。 元気で心が穏やかである。
안녕히	あんねいに【安寧に】	「부사」	安寧히	問題や心配事なく安らかに。
안달복달	やきもき。いらいら。じりじり	「부사」		非常に気を揉みながら苛立って落ち着かず、せき立てる様子。
안되다	1.きのどくだ【気の毒だ】 2.きのどくだ【気の毒だ】	「형용사」		かわいそうで不憫で、心が痛い。 心配事や病気などで顔色がよくない。
안락하다	あんらくだ【安楽だ】 	「형용사」	安樂하다	悩みや心配がなく、心身が楽々としている。
안스럽다		「형용사」		
안쓰럽다	1.きのどくだ【気の毒だ】 2.いたわしい【労しい】。かわいそうだ【可哀想だ・可哀相だ】。きのどくだ【気の毒だ】。ふびんだ【不憫だ】	「형용사」		自分より弱い人に助けてもらったり迷惑をかけたりして申し訳ない。 他人の悪い状況や都合に同情して心を痛める。
안이하다	あんいだ【安易だ】。イージーだ	「형용사」	安易하다	ある事を避けたりたやすいと思ったりして気楽に過ごそうとする。
안일하다	1.あんいつだ【安逸だ・安佚だ】 2.あんいつだ【安逸だ・安佚だ】	「형용사」	安逸하다	気楽で暇である。また、その状態のみを維持しようとする。 責任感なくある事を避けたりたやすいと思ったりしてあまり興味を示さない。
안전하다	あんぜんだ【安全だ】	「형용사」	安全하다	危険が生じたり事故が発生する可能性がない。
안전히	あんぜんに【安全に】	「부사」	安全히	危険が生じたり事故が発生しないように。
안절부절	いらいら。やきもき	「부사」		不安や焦りで途方に暮れたり慌てたりするるさま。
안정적	あんていてき【安定的】	「관형사」		変動したり動揺したりせず一定した状態を維持するようになるさま。 
안타깝다	あわれだ【哀れだ】。きのどくだ【気の毒だ】。かわいそうだ【可哀想だ】。ざんねんだ【残念だ】	「형용사」		思い通りにいかなかったり、可哀想に見えたりして、それに同情して心が痛い。
않다	ない。しない	「보조 동사」		前の語の意味する行動を否定するのに用いる「補助動詞」。
않다	くない。でない	「보조 형용사」		前の語の意味する状態を否定するのに用いる「補助形容詞」。
알-	1.はだか【裸】 2.こ【小】 3.	「접사」		「表面を覆っているものを全部除去した」という意を添加する接頭辞。 「小さい」という意を添加する接頭辞。 「本当」の意を添加する接頭辞。
알	1.じょう【錠】。つぶ【粒】。こ【個】 2.つぶ【粒】。こ【個】	「의존 명사」		小さくて丸い物を数える単位。 小さくて丸い粒状の実や穀物の粒を数える単位。
알뜰하다	1.つましい【倹しい】。けんやくする【倹約する】。せつやくする【節約する】 2.あいじょうぶかい【愛情深い】。けんしんてきだ【献身的だ】	「형용사」		無駄な出費がなく、計画を立ててしっかりと生活する。 他人への思いやりや愛情が誠実で深い。
알뜰히	1.つましく【倹しく】 2.あいじょうぶかく【愛情深く】。けんしんてきに【献身的に】	「부사」		生活で無駄な出費がなく、計画を立ててしっかりと。 他人への思いやりや愛情が誠実で深く。
알랑알랑	ぺこぺこ	「부사」		相手の機嫌を取ったり、気に入られようとおべっかを使うさま。
알록달록	カラフル。まだらに【斑に】	「부사」		色とりどりの縞や斑点などがばらばらになっているさま。
알록달록하다	カラフルだ。まだらだ【斑だ】	「형용사」		色とりどりの縞や斑点などがばらばらになっている状態である。
알맞다	ほどよい【程好い】。てきとうだ【適当だ】	「형용사」		一定の基準や条件、程度に過不足なく一致して、ちょうどよい状態である。
알쏭달쏭	1.まだらに【斑に】 2.あやふや。あいまいに【曖昧に】	「부사」		色とりどりの点や線が混じって模様を成しているさま。 物事がはっきりしなくて当てにならないさま。
알쏭달쏭하다	1.まだらだ【斑だ】 2.あやふやだ。あいまいだ【曖昧だ】	「형용사」		色とりどりの点や線が混じって模様を成している状態だ。 物事がはっきりしなくて当てにならない状態だ。
알짱알짱	1.ぺこぺこ 2.うろうろ	「부사」		相手に気に入られようとお世辞を言いながらだまし続けるさま。 用もなく出歩いたり人の前をうろついたりするさま。
알차다	じゅうじつした【充実した】	「형용사」		中身がいっぱい入っていたり、実利があったりする。
암-	1.めす・め【雌・牝】 2.めす・め【雌・牝】	「접사」		「子をはらむことができる」または「実を結ぶことができる」という意を付加する接頭辞。 「凹になっている」という意を付加する接頭辞。
-암	あん【庵】	「접사」		「小さい寺」の意を付加する接尾辞。
-암	1.がん【岩】 2.がん【岩】	「접사」		「岩石」の意を付加する接尾辞。 「岩」の意を付加する接尾辞。
암담하다	1.あんたんたる【暗澹たる】 2.あんたんたる【暗澹たる】	「형용사」	暗澹하다	非常に暗くて静かで、寂しい。 何の希望もなく、将来の見通しが立たない。
암만	1.いくら【幾ら】。どんなに 2.いくら【幾ら】。どんなに	「부사」		程度が甚だしく。 たとえそうであっても。
암묵적	あんもくてき【暗黙的】	「관형사」		自分の考えや意見を外にはっきりと示さないさま。 
암울하다	1.あんうつだ【暗鬱だ】  2.あんうつだ【暗鬱だ】 	「형용사」	暗鬱하다	非常に暗くて息苦しい。 絶望的で沈鬱である。
암튼	とにかく。ともかく。なにはともあれ【何はともあれ】	「부사」		なにがどうでも。
암팡지다	しっかりする	「형용사」		体は小さくても、力強くて器用である。
압도적	あっとうてき【圧倒的】	「관형사」		優れた力や能力で相手を押さえつけ、反撃できないようにするさま。
앗	1.あっ。おっと 2.よいしょ	「감탄사」		びっくりした時に思わず口から出てくる声。 一瞬に力をこめて何かをする時に出す掛け声。
앙상하다	1.あらっぽい【粗っぽい】。そまつだ【粗末だ】。みすぼらしい【見窄らしい】 2.げっそりする 3.みすぼらしい【見窄らしい】	「형용사」		作りが雑で、抜け目がある。 肉が落ちて痩せ衰える。 葉が落ちて枝しか残っておらず、ものさびしい。
앙상히	1.みすぼらしく【見窄らしく】 2.げっそり 3.みすぼらしく【見窄らしく】	「부사」		作りが雑で、抜け目があるさま。 肉が落ちて痩せ衰えるさま。 葉が落ちて枝しか残っておらず、ものさびしく。
앙증맞다	ちんまりする	「형용사」		小さいながら不足なく整って、可愛らしい。
앙칼스럽다	1.しつようだ【執拗だ】 2.とげとげしい【刺刺しい】。とげたつ【とげ立つ】。つんけんする	「형용사」		手ごわいことに力ずくで取り組むところがある。 非常に荒っぽく、尖っているところがある。
앙칼지다	1.しつようだ【執拗だ】 2.とげとげしい【刺刺しい】。とげたつ【とげ立つ】。つんけんする	「형용사」		手ごわいことに力ずくで取り組む。 非常に荒っぽく、尖っているところがある。
앙큼하다	1.ずるい【狡い】 2.ちゃっかりする	「형용사」		とんでもないことを求めて、身の程知らずの行動をする傾向がある。 見かけとは違って、自分の利益を得るために要領よく振る舞う。
앞서	1.さきだって【先立って】。さきに【先に】 2.さきに【先に】。さきほど【先程】。さきだって【先立って】	「부사」		他人よりはやく。 今より前に。
-애-	させ	「접사」		「使役」の意を付加し、動詞を作る接尾辞。
-애	あい【愛】	「접사」		「愛」の意を付加する接尾辞。
애교스럽다	あいきょうがある【愛嬌がある・愛敬がある】	「형용사」	愛嬌스럽다	人に可愛く見られるように行動する傾向がある。
애국적	あいこくてき【愛国的】	「관형사」		自分の国を愛するさま。
애꿎다	1.むこだ【無辜だ】。むじつだ【無実だ】 2.あらぬ【有らぬ】	「형용사」		罪もないのに、悔しい。 何の関係もない。
애매모호하다	あいまいもことする【曖昧模糊とする】	「형용사」	曖昧模糊하다	話し方や態度などがはっきりしない。
애매하다	むこだ【無辜だ】。むじつだ【無実だ】	「형용사」		罪を犯していないのに、叱られたり処罰されたりして悔しい。
애매하다	あいまいだ【曖昧だ】。あやふやだ	「형용사」		態度や状況がはっきりしない。
애석하다	あいせきする【哀惜する】。きのどくだ【気の毒だ】。なごりおしい【名残惜しい】	「형용사」	哀惜하다	悲しみ惜しむ。
애절하다	あいせつだ【哀切だ】 	「형용사」	哀切하다	非常に哀れでもの悲しい。
애지중지	あいちょう【愛重】	「부사」	愛之重之	非常に愛して大事にするさま。
애통하다	あいつうする【哀痛する】	「형용사」		心から悲しみ、胸が痛い。
애틋하다	1.やるせない【遣る瀬無い】。せつない【切ない】 2.こまやかだ【細やかだ・濃やかだ】	「형용사」		悲しくて胸がしめつけられるようである。 大事にする情が厚い。
-액	がく【額】	「접사」	額	「金額」の意を付加する接尾辞。
앳되다	おさなくみえる【幼く見える】	「형용사」		外見や態度が幼く見える。
야	1.やあ。おや 2.やあ。おい	「감탄사」		驚いた時や誰かに会ってうれしい時に出す声。 大人が子供を呼ぶ時や、年齢の差があまりない人同士で相手を呼びかける時にいう語。
야	は	「조사」		強調の意を表す助詞。
야		「조사」		友だちや目下の人、動物などを呼ぶのに用いる助詞。
야단스럽다	さわがしい【騒がしい】。やかましい	「형용사」	惹端스럽다	しきりにうるさくして騒ぎを起こすところがある。
야단스레	さわがしく【騒がしく】。やかましく	「부사」	惹端스레	しきりにうるさくして騒ぎを起こすところがあるさま。
야드	ヤード	「의존 명사」	yard	長さの単位。
야들야들	1.つやつや。すべすべ 2.	「부사」		つやがあって手触りが柔らかい様子。 声などが清らかで柔らかい様子。
야만스럽다	1.やばんだ【野蛮だ】。サベージだ 2.やばんだ【野蛮だ】。サベージだ	「형용사」	野蠻스럽다	文明の水準が低く開けていないところがある。 行動が礼儀知らずで残忍なところがある。
야만적	1.やばんてき【野蛮的】 2.やばんてき【野蛮的】	「관형사」		文明の水準が低くて開けていないさま。 行動が礼儀知らずで残忍であるさま。
야말로	こそ	「조사」		強調して確認する意を表す助詞。
야무지다	ぬけめがない【抜け目がない】。しっかりしている。がっちりしている	「형용사」		外見や性格、行動などががっちりしていて抜け目がない。
야박스럽다	はくじょうだ【薄情だ】。ふにんじょうだ【不人情だ】。なさけしらずだ【情け知らずだ】	「형용사」	野薄스럽다	心が寛大ではなく、人情が薄いところがある。
야박하다	はくじょうだ【薄情だ】。ふにんじょうだ【不人情だ】。なさけしらずだ【情け知らずだ】	「형용사」	野薄하다	心が寛大ではなく、人情が薄い。
야비하다	ずるい。げひんでいやしい【下品で卑しい】	「형용사」	野卑/野鄙하다	性質や行動が下品で狡猾である。
야성적	やせいてき【野性的】	「관형사」		自然の姿や本能そのままの荒い性質を有しているさま。
야심만만하다	やしんまんまんだ【野心満満だ】	「형용사」	野心滿滿하다	立派なことを成し遂げようとする欲望や望みに満ちている。
야옹	ニャー。ニャン	「부사」		猫の鳴き声。
야하다	いろっぽい【色っぽい】。はでだ【派手だ】	「형용사」	冶하다	性的好奇心を刺激するものがある。
야호	やっほう	「감탄사」		登山する人々が互いに呼んだり叫んだりする時にいう語。
약-	じゃく【弱】	「접사」	弱	「とても力の弱い｣、「勢力の弱い」という意を付加する接頭辞。
약	やく【約】。およそ	「관형사」		ある数量に近接しているさま。
약간	じゃっかん【若干】。たしょう【多少】。すこしばかり【少しばかり】	「부사」		それほど多くない数量で。また、いくらか。
약다	1.かしこい【賢い】。りこうだ【利口だ】 2.かしこい【賢い】。りこうだ【利口だ】。ようりょうがいい【要領がいい】	「형용사」		利益を得る知恵が多い。 難しいことを避け、要領がよくて気が効く。
약삭빠르다	すばしこい。こざかしい【小ざかしい】。こりこうだ【小利口だ】。じょさいない【如才ない】	「형용사」		気がきいていて、自分の利益になるものをいつもちゃっかりと手に入れる。
약소하다	ささやかだ【細やかだ】	「형용사」	略少하다	少なくて粗末だ。
약아빠지다	ずるがしこい【ずる賢い】。こざかしい【小ざかしい】	「형용사」		悪賢くて気がきいている。
약하다	1.よわい【弱い】 2.よわい【弱い】 3.よわい【弱い】。もろい【脆い】 4.よわい【弱い】 5.よわい【弱い】	「형용사」	弱하다	力が少ない。 丈夫でない。 覚悟や意志などが固くない。 耐える力に乏しい。  能力や知識、技術などが足りなかったり低かったりする。
얄궂다	みょうににくい【妙に憎い】	「형용사」		奇妙で悪戯がひどくて何とも憎らしい。
얄밉다	にくたらしい【憎たらしい】	「형용사」		その人の行動や言葉つきが気に入らなくて嫌である。
얄팍하다	1.かなりうすい【かなり薄い】 2.うすい【薄い】。あさはかだ【浅はかだ】	「형용사」		厚みがやや薄い。 深みがなく、すぐに見えそうである。
얇다	1.うすい【薄い】 2.うすい【薄い】 3.うすい【薄い】。あさい【浅い】 4.あさい【浅い】。あさはかだ【浅はかだ】	「형용사」		厚みが少ない。 重なっている物の高さや集団の大きさが普通の程度に及ばない。 色が濃厚でない。 見え透くほど思慮が足りない。
얌전하다	1.ものしずかだ【物静かだ】。おとなしい【大人しい】 2.おとなしい【大人しい】	「형용사」		性格や態度が静かで落ち着いている。 恰好が端正で、整っている。
얌전히	1.おとなしく【大人しく】。しとやかに【淑やかに】。つつましやかに【慎ましやかに】 2.たんせいに【端正に】。つつましやかに【慎ましやかに】。せいぜんと【整然と】	「부사」		性格や態度が物静かで慎み深いように。 整っている模様できちんと。
