word	jp_defs	pos	hanja	jp_trans
짙다	1.こい【濃い】 2.こい【濃い】。みっせいしている【密生している】。しげっている【茂っている】 3.ふかい【深い】。くらい【暗い】 4.ふかい【深い】 5.こい【濃い】。のうこうだ【濃厚だ】 6.つよい【強い】 7.ふかい【深い】。おもい【重い】	「형용사」		色彩や光彩が普通よりはっきりしていて強烈である。 毛などがぎっしりと生えていて普通の程度より色が強烈である。 影や闇などがとてもはっきり見えたり黒く見える。 霧や煙などがいっぱいかかっている。 液体の中にある物質が多く含まれていてその濃度が高い。 においが普通より強烈である。 ある感情や傾向などが普通よりはっきりしていて強烈である。
짙푸르다	こくあおい【濃く青い】。あおあおとする【青青とする】	「형용사」		濃い色で青い。
짜다	1.しおからい【塩辛い】。しょっぱい。からい【辛い】 2.からい【辛い】。けちだ	「형용사」		塩のような味がする。 財物を節約する態度が度を越えていることを俗にいう語。
짜디짜다	1.とてもしおからい【とても塩辛い】。とてもしょっぱい 2.とてもからい【とても辛い】。とてもけちだ	「형용사」		非常に塩辛い味がする。 非常にけちくさい。
-짜리		「접사」		「それほどの数や量がある物」または「それに値する物」の意を付加する接尾辞。 「そのような格好をしている人」の意を付加する接尾辞。 
짜릿짜릿	1.びりびり 2.じいんと	「부사」		とても、または頻繁に体がしびれるように感じる感覚。 心理的な刺激を受けて瞬間的にかなり興奮し、胸騒ぎがする感覚。
짜릿짜릿하다	1.びりびりする 2.じいんとする	「형용사」		とても、また頻繁に体がしびれるように感じる。 心理的な刺激を受けて瞬間的にかなり興奮し、胸騒ぎがする。
짜릿하다	1.びりっとする 2.じいんとする	「형용사」		少し体がしびれるように感じる。 心理的な刺激を受けて瞬間的にかなり興奮し、胸騒ぎがする。
짜증스럽다	いらいらしい【苛苛しい】。いらだつ【苛立つ】	「형용사」		厄介で面倒くさくて嫌である。
짝-	かた【片】	「접사」		「対を成していない」または「対を成すものと調和しない」という意を付加する接頭辞。
짝	ざま。かっこう【格好】。ありさま【有様】	「의존 명사」		「姿」の意味を表す言葉。
-짝		「접사」		「卑下」の意を付加する接尾辞。
짝	1.ちゅっと 2.ばりっと。ぱりっと 3.ぱっくり	「부사」		食欲が湧いて舌鼓を一度打つ音。また、その様子。 物が勢いよく破れたり、隙間が生じる音。また、その様子。 口を大きく開けたり両手・両足などを大きく広げる様子。
짝	1.ぺたっと。ぴったりと。ぴっちりと 2.まったり	「부사」		物体が粘りつくさま。 口に合っておいしいさま。
짝	ぱっと	「부사」		噂などが急に広まる様子。
짝짝	1.すっすっ 2.びりびり 3.ずるずる	「부사」		線や字などをぞんざいに書きなぐる音。また、その様子。 紙や布などをぞんざいに引き裂く音。また、その様子。 靴などを軽く引きずりながら歩く音。また、その様子。
짝짝	1.ちゅっちゅっ 2.ばりばり。ぱりぱり 3.ぱっくりぱっくり	「부사」		食欲が出てしきりに舌鼓を打つ音。また、その様子。 しきりに勢いよく破れたり、隙間が生じる音。また、その様子。 しきりに口を大きく開けたり両手・両足などを大きく広げる様子。
짝짝	1.べたべた  2.まったり	「부사」		物体がしきりに粘りつくさま。 口に合ってとてもおいしいさま。
짝짝	ぱちぱち	「부사」		掌を続けざまに打ち合わせる音。また、その様子。
짠하다	きのどくだ【気の毒だ】。こころぐるしい【心苦しい】	「형용사」		とても残念に思って胸が痛い。
짤따랗다	ちょうみじかい【超短い】	「형용사」		とても短い。
짤랑	りんりん。ちゃらんちゃらん	「부사」		小さい鈴や鉄の破片などが揺れたりぶつかって鳴る音。
짤랑짤랑	りんりん。ちゃらんちゃらん	「부사」		小さい鈴や鉄の破片などがしきりに揺れたりぶつかって鳴る音。
짤록	きゅっと	「부사」		細長い物の一部分がくぼんでいるさま。
짤록하다	きゅっとしている 	「형용사」		細長い物の一部分がくぼんでいる。
짤막하다	みじかめだ【短めだ】	「형용사」		やや短い感じがする。
짧다	1.みじかい【短い】 2.みじかい【短い】 3.みじかい【短い】 4.たりない【足りない】。あさい【浅い】	「형용사」		空間や物体の端から端までの隔たりが小さくて近い。 ある時点から時点までの間隔が久しくない。 文章の分量や口数が少ない。 資本や考え、実力などがある程度や水準に満たない状態である。
짬짬이	ひまひまに【暇暇に】。あいまあいまに【合間合間に】	「부사」		暇がある度に。
짭조름하다	ややしおからい【やや塩辛い】。ややしょっぱい	「형용사」		少ししょっぱい味がする。
짭짤하다	1.ややしおからい【やや塩辛い】。ややしょっぱい 2.ほどよい【程好い】。ゆうしゅうだ【優秀だ】 3.かなりよい【かなり良い】 4.じょうとうだ【上等だ】。こうかだ【高価だ】	「형용사」		少し塩辛い。 物事や行動に隙がなくしっかりしている。 事業などがうまくいって中身が充実している。 物の中身が充実していて価値がある。
짭짭	1.ちっちっ。ちぇっちぇっ 2.ちゅっちゅっ 3.くちゃくちゃ。ぺちゃぺちゃ	「부사」		物事が気に入らない時に苦々しい表情で舌鼓を打つ音。また、その音。 ある食べ物の味見をしたり、おいしくて食欲をそそられた時に、舌を鳴らして舌鼓を打つ音。 食べ物を盛んに食べる音。
짱	がしゃん。がちゃん	「부사」		氷や固くなった物が急に割れる音。また、そのさま。
짱짱하다	1.がんじょうだ【頑丈だ】。がっしりしている 2.かたい【堅い】。かちかちだ。こちこちだ	「형용사」		物の作りや体がしっかりしていて丈夫である。 非常に堅くてかちかちになる。
-째	ごと	「접사」		「ありのまま」または「すべて」の意を付加する接尾辞。 
-째	め【目】。ばんめ【番目】	「접사」		「順番」の意を付加する接尾辞。 
째째하다		「형용사」		
짹짹	ちゅんちゅん。ちゅうちゅう。ちいちい	「부사」		雀などの小鳥がしきりに鳴く声。
쨍	1.があん 2.がしゃん。がちゃん 3.じいん	「부사」		金属などが強くぶつかって高く鳴り響く音。 ガラスや氷がふつかったり割れたりする時に鳴り響く音。 耳がつうんとなるほど、高くて強く鳴り響く音。
쨍	かんかん。じりじり	「부사」		太陽などが強く照りつけるさま。
쨍그랑	がちゃん	「부사」		金属の薄い破片やガラスなどが落ちたりぶつかって鳴り響く音。
쨍그랑쨍그랑	がちゃんがちゃん	「부사」		金属の薄い破片やガラスなどがしきりに落ちたりぶつかって鳴り響く音。
쨍쨍	かんかん。じりじり	「부사」		太陽などがとても強く照りつけるさま。
쨍쨍하다	かんかんする。じりじりする	「형용사」		太陽などがとても強く照りつける状態である。
쨍하다	かんかんする。じりじりする	「형용사」		太陽などが強く照りつける状態である。
쩌렁쩌렁	1.ちゃりんちゃりん 2.がんがん。りんりん	「부사」		金属の薄い破片などがしきりにぶつかって鳴り響く音。 大きい声がしきりに高く鳴り響く音。また、そのさま。
쩌렁쩌렁하다	がんがんする。りんりんする	「형용사」		周りに響き渡るほど、声がとても大きくて高い。
쩌릿하다	1.ひりっとする。びりっとする。じんとする 2.ひりっとする。びりっとする。じんとする	「형용사」		ややしびれた感じである。 心的に刺激を受けて瞬間的に少し興奮し、震える感じがする。
쩍	1.ちゅっ 2.ばりっと。ぱりっと 3.ぱっくり	「부사」		食欲が出て舌鼓を一度大きく打つ音。また、そのさま。 急に物が大きく破れたり、隙間が生じる音。また、そのさま。 口を大きく開けたり両手・両足などを大きく広げるさま。
-쩍다		「접사」		「それらしいところがある」という意を付加し、形容詞を作る接尾辞。 
쩍쩍	1.ちゅっちゅっ 2.ばりばり。ぱりぱり 3.ぱっくりぱっくり	「부사」		食欲が出てしきりに舌鼓を大きく打つ音。また、そのさま。 しきりに物が大きく破れたり、隙間が生じる音。また、そのさま。 しきりに口を大きく開けたり両手・両足などを大きく広げるさま。
쩍쩍	1.べたべた 2.まったり	「부사」		物体がしきりに粘りつくさま。 口に合ってとてもおいしいさま。
쩔뚝쩔뚝	がっくがっく	「부사」		片足が短いか、けがをしてしきりに重心を失ってびっこを引くさま。
쩔쩔	1.ぐらぐら 2.あつあつ【熱熱】。むんむん	「부사」		液体などがとても高い温度で沸騰しているさま。 温度がとても高くて非常に暑いさま。
쩝	ちゅっ	「부사」		食欲が出て舌鼓を打つ音。また、そのさま。
쩝쩝	1.ちっちっ。ちぇっちぇっ 2.ちゅっちゅっ 3.くちゃくちゃ。ぺちゃぺちゃ	「부사」		物事が気に入らない時に苦々しい表情で舌鼓を打つ音。また、そのさま。 ある食べ物の味見をしたり、おいしくて食欲をそそられた時に、舌を鳴らして大きく舌鼓を打つ音。 食べ物をやたらと食べる音。
쩡쩡	1.がしゃん。がちゃん 2.がんがん 3.がんがん	「부사」		氷や堅くなっているものなどが急に割れる時に鳴り響く大きい音。また、そのさま。 とても勢いよく空間全体に響き渡る音。また、そのさま。 権力や勢力がとても高くて羽振りのいいさま。
쩡쩡하다	1.がんがんとする 2.はぶりがいい【羽振りが良い】	「형용사」		音の響きが高くて強い。 権力や勢力がとても高い。
쩨쩨하다	1.つまらない 2.けちだ。けちくさい【けち臭い】。みみっちい	「형용사」		ごく小量であったり優れた点がなくてくだらない。 了見が狭くてしみったれている。
쪼그맣다	ちいさい【小さい】。ちっちゃい	「형용사」		やや小さいか、少ない。
쪼글쪼글	しわくちゃ【皺苦茶】。くしゃくしゃ。しわだらけ【皺だらけ】	「부사」		押し潰されたりしわくちゃになって、不規則にしわがとても多く寄っているさま。
쪼글쪼글하다	しわくちゃだ【皺苦茶だ】。くしゃくしゃだ。しわだらけだ【皺だらけだ】	「형용사」		押し潰されたりしわくちゃになって、不規則にしわがとても多く寄っている。
쪼금	1.すこし【少し】。わずか【僅か】 2.すこし【少し】。ちょっと	「부사」		小量で、または少ない程度で。 所要時間を短くして。
쪼끄맣다	ちいさい【小さい】。ちっちゃい	「형용사」		やや小さいか、少ない。
쪼끔	1.すこし【少し】。わずか【僅か】 2.すこし【少し】。ちょっと	「부사」		小量で、または少ない程度で。 所要時間を短くして。
쪼르르	1.ちょろちょろ。じゃあっと 2.するする。つるつる 3.ちょこちょこ 4.ぞろぞろ。ずらっと	「부사」		細い水流などが速く流れ落ちる音。また、そのさま。 小柄な人や物などが斜面を速く滑り落ちるさま。 足を速く動かして歩いたり誰かの後について歩いたりするさま。 小さい物が一列に並んでいるさま。
쪼르륵	1.ちょろちょろ。じゃあっと 2.するする。つるつる 3.ぐうっと。ぐうぐう	「부사」		細い水流などが速く流れては止まる音。また、そのさま。 子供や小さい物などが斜面を速く滑り落ちては止まるさま。 空腹の時に腹が鳴る音。
쪼르륵쪼르륵	1.ちょろちょろ。じゃあっと 2.するする。つるつる 3.ぐうっと。ぐうぐう	「부사」		細い水流などが速く流れたり止まったりする音。また、そのさま。 小さい物などが斜面を速く滑り落ちたり止まったりするさま。 空腹の時に腹がしきりに鳴る音。
쪼잔하다	きょうりょうだ【狭量だ】	「형용사」		思いやりがあまり無く、度量が狭いことを俗にいう語。
쪽-	1.こ【小】 2.こ【小】	「접사」		「小さい」という意を付加する接頭辞。 「小さい欠片で作った」という意を付加する接頭辞。
쪽	きれ【切れ】。へん【片】	「의존 명사」		割れたり壊れた物の一部を数える単位。
쪽	1.ほう【方】。がわ【側】。ほうめん【方面】 2.ほう【方】。がわ【側】	「의존 명사」		何かに向かって進む方向。 異なる立場のうち、一つを指していう語。
쪽쪽	1.すっすっ 2.びりびり 3.ぐいぐい 4.ちゅうちゅう 5.ぞっと。たらたら 6. 7.げっそり 8.ちゅうちゅう	「부사」		細い線などを相次いで引くさま。 小さい紙や布などを続けて幾筋にも引き裂くさま。 小量の水や飲料を勢いよく続けて飲むさま。 口で勢いよく続けて吸い込む音。また、そのさま。 引き続き鳥肌が立ったり汗が吹き出るさま。 中に入っていた液体が引き続き無くなる様子。 ほっそりと続けてやせていくさま。 相次いで口付けをする音。
쫀득쫀득	しこしこ。ねちゃねちゃ。ねっとり	「부사」		食べ物などを噛んだ時の食感が弾力に富んで歯ごたえが良く、粘り気があって切れにくい感覚。
쫀쫀하다	1.こまかい【細かい】 2.けちくさい【けち臭い】 3.けちくさい【けち臭い】	「형용사」		布などの織り目が細かい。 心が狭く、けちでしみったれだ。 細かなことにこだわって、行動や態度などに抜け目やゆとりがない。
쫄깃쫄깃	しこしこ	「부사」		噛んだ時の食感がとても弾力に富んで固い感覚。
쫄깃쫄깃하다	しこしこする	「형용사」		噛んだ時の食感がとても弾力に富んで固い。
쫄깃하다	しこしこする	「형용사」		噛んだ時の食感がやや弾力があって固い。
쫄딱	かんぜんに【完全に】。すっかり	「부사」		どうしようもなく完全に。
쫄랑쫄랑	1.ちゃぷちゃぷ 2.ちょこちょこ。うろちょろ。おっちょこちょい	「부사」		水などがしきりに波立ちながら揺れる音。また、そのさま。 しきりに落ち着きなく軽々しく動き回るさま。
쫄쫄	ぺこぺこ	「부사」		飯を食べ損なって何も食べていないさま。
쫑긋	つんと。ぴんと	「부사」		口を尖らせたり耳をぴんと立てたりするさま。
쫑긋쫑긋	つんと。ぴんと	「부사」		しきりに口を尖らせたり耳をぴんと立てたりするさま。
쫑긋쫑긋하다	つんとしている。ぴんとたてている【ぴんと立てている】	「형용사」		複数の人が一様に口を尖らせていたり耳をぴんと立てている。
쫑긋하다	つんとしている。ぴんとたてている【ぴんと立てている】	「형용사」		口を尖らせていたり耳をぴんと立てている。
쫑알쫑알	ぶつぶつ	「부사」		主に女性や子供が小さい声で独り言をしきりに言う声。また、そのさま。 
쫙	1.ぱっと 2.ざあっと 3.すらすら。いっきに【一気に】 4.ぱっと。ばりっと。ぱりっと	「부사」		広い範囲、または幾筋に分かれて広がるさま。 雨や水などが急に降り注いだりこぼれ落ちる音。また、そのさま。 物事や行動などが一度に行われるさま。 急に広がったり破れるさま。
쬐금		「부사」		
쬐끔		「부사」		
쭈글쭈글	しわくちゃ【皺苦茶】。くしゃくしゃ。しわだらけ【皺だらけ】	「부사」		押し潰されたりしわくちゃになって、不規則にしわがとても多く寄っているさま。
쭈글쭈글하다	しわくちゃだ【皺苦茶だ】。くしゃくしゃだ。しわだらけだ【皺だらけだ】	「형용사」		押し潰されたりしわくちゃになって、不規則にしわがとても多く寄っている。
쭈르르	1.さらさら。ちょろちょろ。じゃあっと 2.するする。ずるずる 3.ちょこちょこ 4.ぞろぞろ。ずらっと	「부사」		太い水流などが速く流れ落ちる音。また、そのさま。 人や物などが斜面を速く滑り落ちるさま。 足を速く動かして歩いたり誰かの後についていくさま。 複数の物が一列に並んでいるさま。
쭈뼛	1.つんと。にょきっと 2.ぴんと。にょきっと 3.もじもじ。おずおず 4.つんと	「부사」		物の先が少しずつ細くなり、鋭く尖っているさま。 恐怖や驚きなどで髪の毛が逆立つような感覚。 はにかんだり恥ずかしくてためらい躊躇するさま。 口を尖らせて突き出すさま。
쭈뼛쭈뼛	1.つんと。にょきっと 2.ぴんと。にょきっと 3.もじもじ。おずおず 4.つんと	「부사」		物の先が少しずつ細くなり、にょきにょきと突き出るさま。 恐怖や驚きなどで髪の毛がしきりに逆立つような感覚。 はにかんだり恥ずかしくてしきりにためらい躊躇するさま。 口を尖らせて突き出すさま。
쭈뼛쭈뼛하다	つんとしている。にょきにょきとしている	「형용사」		物の先が少しずつ細くなり、にょきにょきと突き出ている。
쭈뼛하다	つんとしている。にょきにょきとしている	「형용사」		物の先が少しずつ細くなり、にょきにょきと突き出ている。
쭉	1.すっと 2.ずらっと。ずっと 3.びりっと 4.ぐいっと 5.すらすら。さっと。すらり 6.しゃんと 7.はっと。ぱっと 8.ずっと 9.ざっと 10.げっそり 11.すっと。すらっと。すらり 12.さっぱりと。きれいに【綺麗に】	「부사」		細い線などを相次いで引くさま。 規則的に一列に並んでいたり、広げられているさま。 紙や布などを一気に引き裂いたり、一筋にするさま。 水などを勢いよく一気に飲むさま。 ある行動をよどみなく一気に続けてするさま。 体を真っ直ぐに伸ばすさま。 水気や気運などが一気に現れたり消えたりするさま。 ある行動を一定時間のあいだ続けてするさま。 広い範囲を一度に眺め回すさま。 体重が急に大幅に減ったさま。 輪郭や姿がとてもなめらかに伸びているさま。 とてもさっぱりと着飾ったさま。
쭉쭉	1.すっすっ 2.ずらっと。ずらりと。ずっと 3.ざあざあ。のびのび。ずっと 4.びりびり 5.ぐいっと 6.ぐいぐい。すぱすぱ 7.すらすら。さっと。すらり 8.しゃんと 9.ぞっと。たらたら 10.じろじろ。ざっと 11.どんどん。すてんすてん	「부사」		細い線などを相次いで引くさま。 物事が相次いで規則的に並んでいるさま。 物事が一列を成して途切れることなく続いているさま。 紙や布などを一筋にも相次いで引き裂くさま。 水や飲み物などを勢いよく一気に飲み込むさま。 口で勢いよく続けて吸い込む音。また、そのさま。 ある行動をよどみなく一気に続けてするさま。 複数の人が相次いで体を伸ばしたり広げたりするさま。 引き続き鳥肌が立ったり汗が吹き出るさま。 あちこちに目をやり、続けて見回すさま。 滑りやすい所から引き続き押し寄せられていくさま。
-쯤	くらい・ぐらい【位】。ほど【程】。ばかり。ぜんご【前後】	「접사」		「程度」の意を付加する接尾辞。 
쯧쯧	ちょっちょっ。ちぇっちぇっ	「부사」		哀れに思ったり気に入らなくてしきりに軽く舌打ちをする音。
쯧쯧	ちょっちょっ。ちぇっちぇっ	「감탄사」		哀れに思ったり気に入らなくてしきりに軽く舌打ちをする音。
찌르르	1.ぴりぴり。びりびり 2.じりじり。じわじわ	「부사」		骨と骨が結合する部分や体の一部がややしびれる感覚。 動きや熱、電気などが一ヶ所から周囲に短時間で広まるさま。
찌르르하다	1.ぴりぴりする。びりびりする 2.じりじりする。じわじわする	「형용사」		骨と骨が結合する部分や体の一部がややしびれる。 動きや熱、電気などが一ヶ所から周囲に短時間で広まる。
찌르릉	ちりりん	「부사」		チャイムや電話ベルなどが鳴る音。
찌릿찌릿	1.ぴりぴり。びりびり。ちくちく 2.じんと。ちくちく	「부사」		骨と骨が結合する部分や体の一部がうずくようにとても痛む感覚。 先の尖った物が続けて刺すように胸・心がとても痛む感覚。
찌릿하다	1.ぴりぴり。びりびり。ちくちく 2.じんと。ちくちく	「형용사」		骨と骨が結合する部分や体の一部がうずくようにかなり痛む。 先の尖った物が続けて刺すように胸・心がかなり痛む。
찌뿌드드하다	1.だるい【怠い】 2.さえない【冴えない】。すぐれない【優れない】 3.くもる【曇る】	「형용사」		風邪などで体が重たくて動くのが自然でない。 表情が気分が晴れず、とても良くない。 雨や雪が降りそうで、とてもどんよりしている。
찍	1.さあっと 2.ぴりっと。びりっと	「부사」		線や字などを勢いよく一回引く音。また、そのさま。 紙や布などを勢いよく引き裂く音。また、そのさま。
찍	1.びちゃっと。びしゃっと 2.すてん。すってん	「부사」		液体が細い水柱を成して勢いよく飛び散る音。また、そのさま。 物体が勢いよく倒れる音。また、そのさま。
찍찍	1.ささっと。ざざっと 2.ぴりっと。びりっと 3.ずるずる	「부사」		線や字などをぞんざいに引きまくったり書きまくる音。また、そのさま。 紙や布などをぞんざいに引き裂く音。また、そのさま。 履物などを引きずりながら歩く音。また、そのさま。
찍찍	1.びちゃびちゃ。びしゃびしゃ 2.すてんすてん。すってんすってん。ずるずる 3.ずばずば	「부사」		液体が細い水柱を成して勢いよく飛び散る音。また、そのさま。 物体が勢いよく倒れる音。また、そのさま。 生意気な言葉を続けざまに言い放つ音。また、そのさま。
-찍하-		「접사」		「やや、またはかなりそうである」という意を付加する接尾辞。 
찐득찐득	1.ねばねば。べとべと 2.かたい【固い】 3.こんきづよく【根気強く】。ねばりづよく【粘り強く】	「부사」		湿っぽくて粘り気があってべたべたとつきやすいさま。 固くてなかなか切れないさま。 性格や行動がとても頑固で根気強いさま。
찐득찐득하다	1.こんきづよい【根気強い】。ねばりづよい【粘り強い】 2.ねばねばする。べとつく	「형용사」		性格や行動がとても頑固で根気強い。 なかなか切れないほど湿っぽくて粘り気が多い。
찐득하다	1.ねばりづよい【粘り強い】 2.ねばりづよい【粘り強い】	「형용사」		性質や行動などがしつこくて根気強い。 よく切れないほど、湿り気や粘り気がある。
찔끔	1.ちょびちょび。ちょろちょろ 2.ぽつんと 3.ちょびちょび。ちびちび。ちびりちびり 4.けちけち。けちくさく【けち臭く】	「부사」		液体などが少しずつ漏れ出ては止まるさま。 雨がほんの少し降っては止むさま。 何かを少しずつこぼすさま。 物やお金などを少しずつ使ったり分けてやるさま。
찔끔	びくっと	「부사」		怖気づいたり驚いて急に後ずさりするようにして肩をすくめるさま。
